Reference Seq,Position,Mutation Type,Sequence Change,Gene,Function,Product,GO Process,GO Component,Details,TOL coumaric acid A1 F50 I1 R1,TOL coumaric acid A2 F50 I1 R1,TOL coumaric acid A2 F50 I2 R1,TOL coumaric acid A2 F50 I3 R1,TOL coumaric acid A3 F50 I1 R1,TOL coumaric acid A3 F50 I2 R1,TOL coumaric acid A3 F50 I3 R1,TOL coumaric acid A4 F50 I1 R1,TOL coumaric acid A4 F50 I2 R1,TOL coumaric acid A4 F50 I3 R1,TOL coumaric acid A5 F50 I1 R1,TOL coumaric acid A5 F50 I2 R1,TOL coumaric acid A5 F50 I3 R1,TOL coumaric acid A6 F50 I1 R1,TOL coumaric acid A6 F50 I2 R1,TOL coumaric acid A6 F50 I3 R1,TOL coumaric acid A7 F50 I1 R1,TOL coumaric acid A7 F50 I2 R1,TOL coumaric acid A8 F50 I1 R1,TOL coumaric acid A8 F50 I2 R1
NC_000913,4627451,DEL,Δ124 bp,nadR,,"trifunctional protein: nicotinamide mononucleotide adenylyltransferase, ribosylnicotinamide kinase, transcriptional repressor",,,coding (137‑260/1233 nt),,1,1,1,,,,,,,,,,,,,,,,
NC_000913,1903497,SNP,T→C,manY,,mannose-specific enzyme IIC component of PTS,,,I139T (ATC→ACC),,,,,1,1,1,,,,,,,1,1,1,1,1,1,1
NC_000913,1293196,MOB,IS5 (+) +4 bp,"hns, tdk",,global DNA-binding transcriptional dual regulator H-NS/thymidine kinase/deoxyuridine kinase,,,intergenic (‑274/‑328),,,,,1,1,1,,,,,,,,,,,,,
NC_000913,3815810,DEL,Δ1 bp,"pyrE, rph",,"orotate phosphoribosyltransferase/ribonuclease PH (defective),enzyme, Degradation of RNA, RNase PH",,,intergenic (‑42/+24),,,,,1,1,1,,,,,,,1,1,1,1,1,1,1
NC_000913,4627567,SNP,C→T,nadR,,"trifunctional protein: nicotinamide mononucleotide adenylyltransferase, ribosylnicotinamide kinase, transcriptional repressor",,,Q85* (CAG→TAG),,,,,,,,1,1,1,,,,,,,,,,
NC_000913,4296381,INS,+GC,"gltP, yjcO",,glutamate/aspartate:proton symporter/Sel1 family TPR-like repeat protein,,,intergenic (+587/+55),1,1,1,1,1,1,1,1,1,1,1,1,1,1,1,1,1,1,1,1
NC_000913,667158,SNP,C→T,mrdA,,"penicillin-binding protein 2, transpeptidase involved in peptidoglycan synthesis",,,D354N (GAC→AAC),,,,,,,,,,,1,1,1,,,,,,,
NC_000913,1352163,SNP,G→A,sapF,,antimicrobial peptide ABC transporter ATPase,,,R158C (CGT→TGT),,1,1,1,,,,,,,1,1,1,,,,,,,
NC_000913,2678755,MOB,IS5 (+) +4 bp,yphF,,putative sugar ABC transporter periplasmic binding protein,,,coding (610‑613/984 nt),,,,,,,,,,,1,,,,,,,,,
NC_000913,2784452,MOB,IS5 (–) +4 bp,ypjC,,pseudogene,,,pseudogene (557‑560/1374 nt),,,,,,,,,,,1,1,1,,,,,,,
NC_000913,3922629,MOB,IS5 (–) +4 bp,"atpI, rsmG",,"ATP synthase, membrane-bound accessory factor/16S rRNA m(7)G527 methyltransferase, SAM-dependent, glucose-inhibited cell-division protein",,,intergenic (‑189/+425),,1,1,1,,,,,,,1,,,,,,,,,
NC_000913,3966751,SNP,C→T,rho,,transcription termination factor,,,A112V (GCG→GTG),,1,1,1,,,,,,,1,1,1,,,,,,,
NC_000913,4054531,DEL,Δ104 bp,glnG,,fused DNA-binding response regulator in two-component regulatory system with GlnL: response regulator/sigma54 interaction protein,,,coding (645‑748/1410 nt),,,,,,,,,,,1,,,,,,,,,
NC_000913,4628232,DEL,Δ1 bp,nadR,,"trifunctional protein: nicotinamide mononucleotide adenylyltransferase, ribosylnicotinamide kinase, transcriptional repressor",,,coding (918/1233 nt),,,,,,,,,,,1,,,,,,,,,
NC_000913,2141832,SNP,A→T,dcd,,"deoxycytidine triphosphate deaminase, dCTP deaminase",,,D128E (GAT→GAA),,,,,,,,1,1,1,,,,,,,,,,
NC_000913,3440924,SNP,C→G,rpoA,,"RNA polymerase, alpha subunit",,,G36R (GGC→CGC),,,,,,,,1,1,1,,,,,,,,,,
NC_000913,3473615,SNP,C→T,rpsG,,30S ribosomal subunit protein S7,,,W156* (TGG→TAG),,,,,,,,1,1,1,,,,,,,,,,
NC_000913,1978503,DEL,Δ776 bp,"insB1, insA",,"insB1, insA",,,,1,1,1,1,1,1,1,1,1,1,1,1,1,1,1,1,1,1,1,1
NC_000913,1347892,MOB,IS5 (–) +4 bp,rnb,,ribonuclease II,,,coding (1018‑1021/1935 nt),,,,,,,,,,,,,,1,1,1,,,,
NC_000913,3317438,SNP,G→A,nusA,,transcription termination/antitermination L factor,,,A30V (GCG→GTG),,,,,,,,,,,,,,1,1,1,,,,
NC_000913,3530902,SNP,A→G,yhgE,,DUF4153 family putative inner membrane protein,,,V513A (GTC→GCC),,,,,,,,,,,,,,1,1,1,,,,
NC_000913,3966727,SNP,C→T,rho,,transcription termination factor,,,P104L (CCG→CTG),1,,,,1,1,1,,,,,,,1,1,1,1,1,,
NC_000913,4544671,MOB,+G :: IS5 (–) +3 bp,fimC,,periplasmic chaperone,,,coding (368‑370/726 nt),,,,,,,,,,,,,,,,1,,,,
NC_000913,4569172,SNP,G→A,yjiP,,"pseudogene, transposase_31 family protein",,,pseudogene (175/921 nt),,,,,,,,,,,,,,1,1,1,,,,
NC_000913,102228,DEL,Δ1 bp,murC,,UDP-N-acetylmuramate:L-alanine ligase,,,coding (1464/1476 nt),,1,1,1,,,,,,,,,,,,,,,,
NC_000913,1299499,DEL,"Δ1,199 bp","ychE, oppA",,UPF0056 family inner membrane protein/oligopeptide ABC transporter periplasmic binding protein,,,intergenic (+254/‑485),1,,1,,,,,,,,,,,,,1,1,,,1
NC_000913,2801966,DEL,"Δ11,843 bp","[nrdE], nrdF, proV, proW, proX, ygaY, ygaY, ygaZ, ygaH, mprA, emrA, [emrB]",,"[nrdE], nrdF, proV, proW, proX, ygaY, ygaY, ygaZ, ygaH, mprA, emrA, [emrB]",,,,,,,,,,,,,,,,,,,,,,1,1
NC_000913,3685181,DEL,Δ273 bp,yhjK,,cyclic-di-GMP phosphodiesterase,,,coding (166‑438/1989 nt),,,,,,,,,,,,,,,,,,,,1
NC_000913,3966718,INS,+GAT,rho,,transcription termination factor,,,coding (302/1260 nt),,,,,,,,,,,,,,,,,,,,1
NC_000913,1908812,MOB,IS5 (–) +4 bp,"mgrB, yobH",,"regulatory peptide for PhoPQ, feedback inhibition/uncharacterized protein",,,intergenic (‑46/‑110),,,,,,,,,,,,,,,,,,1,,
NC_000913,2782626,MOB,IS5 (–) +4 bp,ypjA,,adhesin-like autotransporter,,,coding (98‑101/4581 nt),,,,,,,,,,,,,,,,,1,1,,
NC_000913,2810804,DEL,Δ1 bp,mprA,,transcriptional repressor of microcin B17 synthesis and multidrug efflux,,,coding (35/531 nt),,,,,,,,,,,,,,,,,1,1,,
NC_000913,4183814,SNP,T→A,rpoB,,"RNA polymerase, beta subunit",,,V857E (GTG→GAG),,,,,,,,,,,,,,,,,1,1,,
NC_000913,954638,SNP,C→T,"focA, ycaO",,formate channel/ribosomal protein S12 methylthiotransferase accessory factor,,,intergenic (‑172/+234),,,,,,,,,,,,,1,,,,,,,
NC_000913,1768309,SNP,A→T,ydiJ,,putative FAD-linked oxidoreductase,,,V126E (GTG→GAG),,,,,,,,,,,,,1,,,,,,,
NC_000913,3471319,DEL,(T)5→4,tufA,,translation elongation factor EF-Tu 1,,,coding (11/1185 nt),,,,,,,,,,,,,1,,,,,,,
NC_000913,3922570,INS,+TAG,"atpI, rsmG",,"ATP synthase, membrane-bound accessory factor/16S rRNA m(7)G527 methyltransferase, SAM-dependent, glucose-inhibited cell-division protein",,,intergenic (‑130/+487),,,,,,,,,,,,,1,,,,,,,
NC_000913,1961829,MOB,IS5 (–) +4 bp,"argS, yecT",,arginyl-tRNA synthetase/uncharacterized protein,,,intergenic (+34/‑140),,,1,,,,,,,,,,,,,,,,,
NC_000913,2297586,MOB,IS5 (+) +4 bp,ccmA,,heme export ABC transporter ATPase,,,coding (56‑59/624 nt),,,1,,,,,,,,,,,,,,,,,
NC_000913,4099695,SNP,G→A,rhaT,,L-rhamnose:proton symporter,,,A277A (GCC→GCT),,,1,,,,,,,,,,,,,,,,,
NC_000913,260217,DEL,"Δ13,738 bp","proB, proA, thrW, ykfN, ykfI, yafW, ykfH, ykfG, yafX, ykfF, ykfB, yafY, ykfL, ykfK, yafZ, ykfA, perR, insN, insI1, insN, eyeA, [ykfC]",,"<i><b>22 genes</b><BR>proB, proA, thrW, ykfN, ykfI, yafW, ykfH, ykfG, yafX, ykfF, ykfB, yafY, ykfL, ykfK, yafZ, ykfA, perR, insN, insI1, insN, eyeA, [ykfC]</i>",,,IS5‑mediated,,,,,1,,,,,,,,,,,,,,,
NC_000913,663746,SNP,C→T,dacA,,D-alanyl-D-alanine carboxypeptidase (penicillin-binding protein 5),,,S73N (AGC→AAC),,,,,1,1,1,,,,,,,,,,,,,
NC_000913,2810080,DEL,"Δ1,165 bp","[ygaZ], ygaH, [mprA]",,"[ygaZ], ygaH, [mprA]",,,,,,,,1,1,1,,,,,,,,,,,,,
NC_000913,3922483,SNP,G→A,"atpI, rsmG",,"ATP synthase, membrane-bound accessory factor/16S rRNA m(7)G527 methyltransferase, SAM-dependent, glucose-inhibited cell-division protein",,,intergenic (‑43/+574),,,,,1,1,1,,,,,,,,,,,,,
NC_000913,4183802,SNP,A→G,rpoB,,"RNA polymerase, beta subunit",,,D853G (GAC→GGC),,,,,1,1,1,,,,,,,,,,,,,
NC_000913,1436746,SNP,T→C,ompN,,"outer membrane pore protein N, non-specific",,,K50E (AAA→GAA),,,,,,,,,1,,,,,,,,,,,
NC_000913,2743181,SNP,A→G,yfiN,,putative membrane-anchored diguanylate cyclase,,,I267V (ATC→GTC),,,,,,,,,1,,,,,,,,,,,
NC_000913,4628214,DEL,Δ1 bp,nadR,,"trifunctional protein: nicotinamide mononucleotide adenylyltransferase, ribosylnicotinamide kinase, transcriptional repressor",,,coding (900/1233 nt),,,,,,,,,,,,1,,,,,,,,
NC_000913,1856052,MOB,IS5 (+) +4 bp,ydjH,,putative kinase,,,coding (874‑877/948 nt),,,,,,,,,,,,,,,,,1,,,
NC_000913,3277273,INS,(TTCAACA)2→3,prlF,,antitoxin of the SohA(PrlF)-YhaV toxin-antitoxin system,,,coding (272/336 nt),,,,,,,,,,,,,,,,,1,,,
NC_000913,2374,SNP,G→T,thrA,,Bifunctional aspartokinase/homoserine dehydrogenase 1,,,A680S (GCG→TCG),,,,,,,,,,,,,,,,,,,1,
NC_000913,3683736,DEL,Δ1 bp,yhjK,,cyclic-di-GMP phosphodiesterase,,,coding (1883/1989 nt),,,,,,,,,,,,,,,,,,,1,
NC_000913,4185540,SNP,C→T,rpoC,,"RNA polymerase, beta prime subunit",,,P64L (CCG→CTG),1,1,1,1,,,,,,,1,1,1,,,,,,,
NC_000913,1168483,SNP,C→T,ycfQ,,repressor for bhsA(ycfR),,,C117Y (TGC→TAC),1,,,,,,,,,,,,,,,,,,,
NC_000913,1354284,SNP,C→A,sapC,,antimicrobial peptide transport ABC transporter permease,,,G79W (GGG→TGG),1,,,,,,,,,,,,,,,,,,,
NC_000913,4546637,DEL,Δ1 bp,fimD,,"fimbrial usher outer membrane porin protein, FimCD chaperone-usher",,,coding (1542/2637 nt),1,,,,,,,,,,,,,,,,,,,
NC_000913,4627958,SNP,C→T,nadR,,"trifunctional protein: nicotinamide mononucleotide adenylyltransferase, ribosylnicotinamide kinase, transcriptional repressor",,,P215L (CCG→CTG),1,,,,,,,,,,,,,,,,,,,
NC_000913,4375431,SNP,A→C,epmB,,"EF-P-Lys34 lysylation protein, weak lysine 2,3-aminomutase",,,V76G (GTA→GGA),,,,,,,,1,,,,,,,,,,,,
NC_000913,257908,DEL,Δ776 bp,[crl],,[crl],,,,1,1,1,1,1,1,1,1,1,1,1,1,1,1,1,1,1,1,1,1
NC_000913,2173363,DEL,Δ2 bp,"gatC, gatC",,"pseudogene, galactitol-specific enzyme IIC component of PTS,transport, Transport of small molecules: Carbohydrates, organic acids, alcohols, PTS system galactitol-specific enzyme IIC/pseudogene, galactitol-specific enzyme IIC component of PTS,transport, Transport of small molecules: Carbohydrates, organic acids, alcohols, PTS system galactitol-specific enzyme IIC",,,intergenic (‑1/+1),1,1,1,1,1,1,1,1,1,1,1,1,1,1,1,1,1,1,1,1
NC_000913,3560455,INS,+G,"glpR, glpR",,"pseudogene, DNA-binding transcriptional repressor,regulator, Energy metabolism, carbon: Anaerobic respiration, repressor of the glp operon/pseudogene, DNA-binding transcriptional repressor,regulator, Energy metabolism, carbon: Anaerobic respiration, repressor of the glp operon",,,intergenic (‑2/+1),1,1,1,1,1,1,1,1,1,1,1,1,1,1,1,1,1,1,1,1
NC_000913,64352,SNP,G→C,polB,,DNA polymerase II,,,R477G (CGC→GGC),1,,,,,,,,,,,,,,,,,,,
